<!ELEMENT ligaFutbol (partidos)*>
<!ELEMENT partidos (equipoLocal,equipoVisitante)>
<!ELEMENT equipoLocal EMPTY>
<!ATTLIST equipoLocal goles NMTOKEN #REQUIRED>
<!ATTLIST equipoLocal nombre CDATA #REQUIRED>
<!ELEMENT equipoVisitante EMPTY>
<!ATTLIST equipoVisitante goles NMTOKEN #REQUIRED>
<!ATTLIST equipoVisitante nombre CDATA #REQUIRED>